{
  "schemaVersion": 2,
  "id": "agon.campfire",
  "name": "Campfire",
  "version": "1.0.0",
  "apiRange": ">=1.0.0 <2",
  "execution": "executable",
  "compatibility": {
    "kernelRange": ">=0.0.0-0 <2",
    "nodeRange": ">=22"
  },
  "packageClass": "user-toggleable-mod-package",
  "entrypoints": {
    "runtime": "dist/index.js",
    "types": "dist/index.d.ts"
  },
  "display": {
    "group": "Create and compete",
    "order": 102
  },
  "dependencies": {
    "required": [
      {
        "id": "agon.api",
        "range": ">=0.0.0-0"
      },
      {
        "id": "agon.engine-runtime",
        "range": ">=0.0.0-0"
      },
      {
        "id": "agon.panel",
        "range": ">=0.0.0-0"
      }
    ],
    "optional": [],
    "conflicts": []
  },
  "permissions": [
    {
      "capability": "engine.dispatch",
      "resources": [],
      "required": true
    }
  ],
  "platforms": [
    "darwin-arm64",
    "darwin-x64",
    "linux-arm64",
    "linux-x64"
  ],
  "assets": [
    {
      "path": "ownership.json",
      "kind": "documentation",
      "mediaType": "application/json",
      "contentHash": "sha256:c883518cd3865d7d759781aae90639a8a184d31e759fa49d0d3fc599299f46d7",
      "bytes": 2961,
      "executable": false,
      "platforms": [
        "darwin-arm64",
        "darwin-x64",
        "linux-arm64",
        "linux-x64"
      ]
    },
    {
      "path": "schemas/config.schema.json",
      "kind": "schema",
      "mediaType": "application/schema+json",
      "contentHash": "sha256:b6582132d49f3af8f577eeacb1093e34f5d2d0ed3fbea5b9c20db17b39a837cb",
      "bytes": 222,
      "executable": false,
      "platforms": [
        "darwin-arm64",
        "darwin-x64",
        "linux-arm64",
        "linux-x64"
      ]
    }
  ],
  "contributes": {
    "cliCommands": [
      {
        "id": "cliCommands:0010",
        "aliases": []
      }
    ],
    "tuiActions": [
      {
        "id": "intentVariants:0007",
        "aliases": []
      },
      {
        "id": "builtinCommandMetadata:0008",
        "aliases": []
      },
      {
        "id": "tuiSlashCommands:0008",
        "aliases": []
      }
    ],
    "mcpTools": [
      {
        "id": "mcpTools:0005",
        "aliases": []
      }
    ],
    "cesarTools": [
      {
        "id": "cesarTools:0003",
        "aliases": []
      },
      {
        "id": "cesarRoutes:0010",
        "aliases": []
      },
      {
        "id": "cesarRoutes:0011",
        "aliases": []
      },
      {
        "id": "cesarRoutes:0012",
        "aliases": []
      },
      {
        "id": "cesarRoutes:0013",
        "aliases": []
      }
    ],
    "lifecycleHooks": [],
    "resultTypes": [
      {
        "id": "resultAndEnvelopeTypes:0022",
        "aliases": []
      }
    ],
    "configKeys": [],
    "generatedDocs": []
  },
  "pack": {
    "include": [
      "LICENSE",
      "agon.mod.json",
      "dist/index.js",
      "dist/index.d.ts",
      "dist/implementation.d.ts",
      "ownership.json",
      "schemas/config.schema.json"
    ],
    "executable": []
  }
}
