{
  "schemaVersion": 2,
  "id": "agon.conquer",
  "name": "Conquer",
  "version": "1.0.0",
  "apiRange": ">=1.0.0 <2",
  "execution": "executable",
  "compatibility": {
    "kernelRange": ">=0.0.0-0 <2",
    "nodeRange": ">=22"
  },
  "packageClass": "user-toggleable-mod-package",
  "entrypoints": {
    "runtime": "dist/index.js",
    "types": "dist/index.d.ts"
  },
  "display": {
    "group": "Work",
    "order": 5
  },
  "dependencies": {
    "required": [
      {
        "id": "agon.api",
        "range": ">=0.0.0-0"
      },
      {
        "id": "agon.engine-runtime",
        "range": ">=0.0.0-0"
      },
      {
        "id": "agon.agent",
        "range": ">=0.0.0-0"
      },
      {
        "id": "agon.nero",
        "range": ">=0.0.0-0"
      },
      {
        "id": "agon.tribunal",
        "range": ">=0.0.0-0"
      },
      {
        "id": "agon.brainstorm",
        "range": ">=0.0.0-0"
      },
      {
        "id": "agon.council",
        "range": ">=0.0.0-0"
      },
      {
        "id": "agon.worktree",
        "range": ">=0.0.0-0"
      },
      {
        "id": "agon.verification",
        "range": ">=0.0.0-0"
      }
    ],
    "optional": [],
    "conflicts": []
  },
  "permissions": [
    {
      "capability": "engine.dispatch",
      "resources": [],
      "required": true
    },
    {
      "capability": "git.write",
      "resources": [],
      "required": false
    }
  ],
  "platforms": [
    "darwin-arm64",
    "darwin-x64",
    "linux-arm64",
    "linux-x64"
  ],
  "assets": [
    {
      "path": "ownership.json",
      "kind": "documentation",
      "mediaType": "application/json",
      "contentHash": "sha256:e3da1ace0a067f35c742ebd68c7ad8d331da36a18d67a4978d14570daaf741c3",
      "bytes": 1658,
      "executable": false,
      "platforms": [
        "darwin-arm64",
        "darwin-x64",
        "linux-arm64",
        "linux-x64"
      ]
    },
    {
      "path": "schemas/config.schema.json",
      "kind": "schema",
      "mediaType": "application/schema+json",
      "contentHash": "sha256:c38de1f53d3c0a2aec3a35e35c95f2c6c0bca7409dfb62dc6530b7cff4a6a70b",
      "bytes": 220,
      "executable": false,
      "platforms": [
        "darwin-arm64",
        "darwin-x64",
        "linux-arm64",
        "linux-x64"
      ]
    }
  ],
  "contributes": {
    "cliCommands": [
      {
        "id": "cliCommands:0013",
        "aliases": []
      }
    ],
    "tuiActions": [
      {
        "id": "tuiSlashCommands:0021",
        "aliases": []
      }
    ],
    "mcpTools": [],
    "cesarTools": [
      {
        "id": "cesarTools:0004",
        "aliases": []
      },
      {
        "id": "cesarRoutes:0016",
        "aliases": []
      }
    ],
    "lifecycleHooks": [],
    "resultTypes": [
      {
        "id": "resultAndEnvelopeTypes:0037",
        "aliases": []
      },
      {
        "id": "resultAndEnvelopeTypes:0055",
        "aliases": []
      }
    ],
    "configKeys": [],
    "generatedDocs": []
  },
  "pack": {
    "include": [
      "LICENSE",
      "agon.mod.json",
      "dist/index.js",
      "dist/index.d.ts",
      "dist/implementation.d.ts",
      "dist/completion-policy.d.ts",
      "dist/workflow.d.ts",
      "dist/falsifier.d.ts",
      "dist/host.d.ts",
      "dist/isolation.d.ts",
      "dist/publication.d.ts",
      "ownership.json",
      "schemas/config.schema.json"
    ],
    "executable": []
  }
}
