{
  "schemaVersion": 2,
  "id": "agon.agent",
  "name": "Agent",
  "version": "1.0.0",
  "apiRange": ">=1.0.0 <2",
  "execution": "executable",
  "compatibility": {
    "kernelRange": ">=0.0.0-0 <2",
    "nodeRange": ">=22"
  },
  "packageClass": "user-toggleable-mod-package",
  "entrypoints": {
    "runtime": "dist/index.js",
    "types": "dist/index.d.ts"
  },
  "display": {
    "group": "Work",
    "order": 3
  },
  "dependencies": {
    "required": [
      {
        "id": "agon.api",
        "range": ">=0.0.0-0"
      },
      {
        "id": "agon.engine-runtime",
        "range": ">=0.0.0-0"
      },
      {
        "id": "agon.agent-runtime",
        "range": ">=0.0.0-0"
      }
    ],
    "optional": [],
    "conflicts": []
  },
  "permissions": [
    {
      "capability": "engine.dispatch",
      "resources": [],
      "required": true
    }
  ],
  "platforms": [
    "darwin-arm64",
    "darwin-x64",
    "linux-arm64",
    "linux-x64"
  ],
  "assets": [
    {
      "path": "ownership.json",
      "kind": "documentation",
      "mediaType": "application/json",
      "contentHash": "sha256:4799cd64f682d2e62fd2a5b50f78e92fb0136c28f818d0638e8ce68f9c284d88",
      "bytes": 10429,
      "executable": false,
      "platforms": [
        "darwin-arm64",
        "darwin-x64",
        "linux-arm64",
        "linux-x64"
      ]
    },
    {
      "path": "schemas/config.schema.json",
      "kind": "schema",
      "mediaType": "application/schema+json",
      "contentHash": "sha256:449969a5ee41c0d202bb5e5093bb29b43e0097873ccb3c23de5d487be2bf5f70",
      "bytes": 401,
      "executable": false,
      "platforms": [
        "darwin-arm64",
        "darwin-x64",
        "linux-arm64",
        "linux-x64"
      ]
    }
  ],
  "contributes": {
    "cliCommands": [],
    "tuiActions": [
      {
        "id": "intentVariants:0000",
        "aliases": []
      },
      {
        "id": "intentVariants:0001",
        "aliases": []
      },
      {
        "id": "intentVariants:0006",
        "aliases": []
      },
      {
        "id": "intentVariants:0054",
        "aliases": []
      },
      {
        "id": "intentVariants:0058",
        "aliases": []
      },
      {
        "id": "builtinCommandMetadata:0000",
        "aliases": []
      },
      {
        "id": "builtinCommandMetadata:0001",
        "aliases": []
      },
      {
        "id": "builtinCommandMetadata:0007",
        "aliases": []
      },
      {
        "id": "builtinCommandMetadata:0042",
        "aliases": []
      },
      {
        "id": "builtinCommandMetadata:0043",
        "aliases": []
      },
      {
        "id": "tuiSlashCommands:0000",
        "aliases": []
      },
      {
        "id": "tuiSlashCommands:0001",
        "aliases": []
      },
      {
        "id": "tuiSlashCommands:0007",
        "aliases": []
      },
      {
        "id": "tuiSlashCommands:0061",
        "aliases": []
      }
    ],
    "mcpTools": [
      {
        "id": "mcpTools:0000",
        "aliases": []
      },
      {
        "id": "mcpTools:0006",
        "aliases": []
      }
    ],
    "cesarTools": [
      {
        "id": "cesarTools:0000",
        "aliases": []
      },
      {
        "id": "cesarTools:0006",
        "aliases": []
      },
      {
        "id": "cesarRoutes:0000",
        "aliases": []
      },
      {
        "id": "cesarRoutes:0001",
        "aliases": []
      },
      {
        "id": "cesarRoutes:0009",
        "aliases": []
      },
      {
        "id": "cesarRoutes:0018",
        "aliases": []
      },
      {
        "id": "cesarRoutes:0019",
        "aliases": []
      },
      {
        "id": "cesarRoutes:0020",
        "aliases": []
      },
      {
        "id": "cesarRoutes:0040",
        "aliases": []
      },
      {
        "id": "cesarRoutes:0041",
        "aliases": []
      },
      {
        "id": "cesarRoutes:0059",
        "aliases": []
      },
      {
        "id": "cesarRoutes:0060",
        "aliases": []
      }
    ],
    "lifecycleHooks": [],
    "resultTypes": [
      {
        "id": "resultAndEnvelopeTypes:0000",
        "aliases": []
      },
      {
        "id": "resultAndEnvelopeTypes:0002",
        "aliases": []
      },
      {
        "id": "resultAndEnvelopeTypes:0004",
        "aliases": []
      },
      {
        "id": "resultAndEnvelopeTypes:0005",
        "aliases": []
      },
      {
        "id": "resultAndEnvelopeTypes:0006",
        "aliases": []
      },
      {
        "id": "resultAndEnvelopeTypes:0007",
        "aliases": []
      },
      {
        "id": "resultAndEnvelopeTypes:0010",
        "aliases": []
      },
      {
        "id": "resultAndEnvelopeTypes:0011",
        "aliases": []
      },
      {
        "id": "resultAndEnvelopeTypes:0012",
        "aliases": []
      }
    ],
    "configKeys": [
      {
        "id": "configKeys:0012",
        "aliases": []
      }
    ],
    "generatedDocs": []
  },
  "pack": {
    "include": [
      "LICENSE",
      "agon.mod.json",
      "dist/index.js",
      "dist/index.d.ts",
      "dist/implementation.d.ts",
      "dist/team-refinement.d.ts",
      "dist/events.d.ts",
      "dist/team-results.d.ts",
      "dist/team-scoring.d.ts",
      "dist/team-runtime.d.ts",
      "ownership.json",
      "schemas/config.schema.json"
    ],
    "executable": []
  }
}
