{
  "schemaVersion": 2,
  "id": "agon.browser",
  "name": "Browser",
  "version": "0.0.0-slice.5",
  "apiRange": ">=1.0.0 <2",
  "execution": "executable",
  "compatibility": {
    "kernelRange": ">=0.0.0-0 <2",
    "nodeRange": ">=22"
  },
  "packageClass": "user-toggleable-mod-package",
  "entrypoints": {
    "runtime": "dist/index.js",
    "types": "dist/index.d.ts"
  },
  "display": {
    "group": "Interfaces",
    "order": 600
  },
  "dependencies": {
    "required": [
      {
        "id": "agon.api",
        "range": ">=0.0.0-0"
      },
      {
        "id": "agon.engine-runtime",
        "range": ">=0.0.0-0"
      },
      {
        "id": "agon.browser-bridge",
        "range": ">=0.0.0-0"
      },
      {
        "id": "agon.agent-runtime",
        "range": ">=0.0.0-0"
      }
    ],
    "optional": [],
    "conflicts": []
  },
  "permissions": [],
  "platforms": [
    "darwin-arm64",
    "darwin-x64",
    "linux-arm64",
    "linux-x64"
  ],
  "assets": [
    {
      "path": "ownership.json",
      "kind": "documentation",
      "mediaType": "application/json",
      "contentHash": "sha256:650ee61f69d6f46f66d43fae7c7d0a5f82fc176116f9f4f15ce89b397121b7b1",
      "bytes": 4520,
      "executable": false,
      "platforms": [
        "darwin-arm64",
        "darwin-x64",
        "linux-arm64",
        "linux-x64"
      ]
    },
    {
      "path": "schemas/config.schema.json",
      "kind": "schema",
      "mediaType": "application/schema+json",
      "contentHash": "sha256:af47aec834d77f2465d3f4be734fab57b1428e70b0b40dc518d37e9533c00d1b",
      "bytes": 220,
      "executable": false,
      "platforms": [
        "darwin-arm64",
        "darwin-x64",
        "linux-arm64",
        "linux-x64"
      ]
    }
  ],
  "contributes": {
    "cliCommands": [
      {
        "id": "cliCommands:0004",
        "aliases": []
      },
      {
        "id": "cliCommands:0005",
        "aliases": []
      },
      {
        "id": "cliCommands:0006",
        "aliases": []
      },
      {
        "id": "cliCommands:0007",
        "aliases": []
      },
      {
        "id": "cliCommands:0008",
        "aliases": []
      },
      {
        "id": "cliCommands:0011",
        "aliases": []
      },
      {
        "id": "cliCommands:0017",
        "aliases": []
      },
      {
        "id": "cliCommands:0019",
        "aliases": []
      },
      {
        "id": "cliCommands:0020",
        "aliases": []
      },
      {
        "id": "cliCommands:0021",
        "aliases": []
      },
      {
        "id": "cliCommands:0057",
        "aliases": []
      }
    ],
    "tuiActions": [
      {
        "id": "tuiSlashCommands:0015",
        "aliases": []
      }
    ],
    "mcpTools": [],
    "cesarTools": [],
    "lifecycleHooks": [],
    "resultTypes": [],
    "configKeys": [],
    "generatedDocs": []
  },
  "pack": {
    "include": [
      "agon.mod.json",
      "dist/index.js",
      "dist/index.d.ts",
      "ownership.json",
      "schemas/config.schema.json"
    ],
    "executable": []
  }
}
