{
  "schemaVersion": 2,
  "id": "agon.review",
  "name": "Review",
  "version": "1.0.0",
  "apiRange": ">=1.0.0 <2",
  "execution": "executable",
  "compatibility": {
    "kernelRange": ">=0.0.0-0 <2",
    "nodeRange": ">=22"
  },
  "packageClass": "user-toggleable-mod-package",
  "entrypoints": {
    "runtime": "dist/index.js",
    "types": "dist/index.d.ts"
  },
  "display": {
    "group": "Review and decide",
    "order": 200
  },
  "dependencies": {
    "required": [
      {
        "id": "agon.api",
        "range": ">=0.0.0-0"
      },
      {
        "id": "agon.engine-runtime",
        "range": ">=0.0.0-0"
      },
      {
        "id": "agon.panel",
        "range": ">=0.0.0-0"
      },
      {
        "id": "agon.verification",
        "range": ">=0.0.0-0"
      },
      {
        "id": "agon.worktree",
        "range": ">=0.0.0-0"
      }
    ],
    "optional": [],
    "conflicts": []
  },
  "permissions": [
    {
      "capability": "engine.dispatch",
      "resources": [],
      "required": true
    }
  ],
  "platforms": [
    "darwin-arm64",
    "darwin-x64",
    "linux-arm64",
    "linux-x64"
  ],
  "assets": [
    {
      "path": "ownership.json",
      "kind": "documentation",
      "mediaType": "application/json",
      "contentHash": "sha256:a8569f0569a53af69c1d519d678bfb7048a1f424d813245298110a2e884345c8",
      "bytes": 4492,
      "executable": false,
      "platforms": [
        "darwin-arm64",
        "darwin-x64",
        "linux-arm64",
        "linux-x64"
      ]
    },
    {
      "path": "schemas/config.schema.json",
      "kind": "schema",
      "mediaType": "application/schema+json",
      "contentHash": "sha256:d891ac0d3e221ecdb678d514b5299b55f4dfeea3497fb1bb6bca08837f2b5e8c",
      "bytes": 499,
      "executable": false,
      "platforms": [
        "darwin-arm64",
        "darwin-x64",
        "linux-arm64",
        "linux-x64"
      ]
    }
  ],
  "contributes": {
    "cliCommands": [
      {
        "id": "cliCommands:0063",
        "aliases": []
      }
    ],
    "tuiActions": [
      {
        "id": "intentVariants:0051",
        "aliases": []
      },
      {
        "id": "builtinCommandMetadata:0040",
        "aliases": []
      },
      {
        "id": "tuiSlashCommands:0057",
        "aliases": []
      },
      {
        "id": "tuiSlashCommands:0058",
        "aliases": []
      }
    ],
    "mcpTools": [
      {
        "id": "mcpTools:0021",
        "aliases": []
      }
    ],
    "cesarTools": [
      {
        "id": "cesarTools:0023",
        "aliases": []
      },
      {
        "id": "cesarRoutes:0042",
        "aliases": []
      },
      {
        "id": "cesarRoutes:0043",
        "aliases": []
      },
      {
        "id": "cesarRoutes:0044",
        "aliases": []
      },
      {
        "id": "cesarRoutes:0045",
        "aliases": []
      },
      {
        "id": "cesarRoutes:0046",
        "aliases": []
      },
      {
        "id": "cesarRoutes:0047",
        "aliases": []
      }
    ],
    "lifecycleHooks": [],
    "resultTypes": [
      {
        "id": "resultAndEnvelopeTypes:0107",
        "aliases": []
      },
      {
        "id": "resultAndEnvelopeTypes:0108",
        "aliases": []
      }
    ],
    "configKeys": [
      {
        "id": "configKeys:0007",
        "aliases": []
      },
      {
        "id": "configKeys:0087",
        "aliases": []
      }
    ],
    "generatedDocs": []
  },
  "pack": {
    "include": [
      "LICENSE",
      "agon.mod.json",
      "dist/index.js",
      "dist/index.d.ts",
      "dist/implementation.d.ts",
      "ownership.json",
      "schemas/config.schema.json"
    ],
    "executable": []
  }
}
